{
  "taskId": "DREAM-BUILDER-MOBILE-SCREEN-01",
  "description": "Build a reversible two-screen Dream Builder mobile prototype.",
  "domain": "SOFTWARE",
  "mode": "PROTOTYPE",
  "riskLevel": "LOW",
  "authorityLevel": "RECOMMENDATION_ONLY",
  "reversible": true,
  "affectedParties": 1,
  "commitments": {
    "money": 0,
    "timeHours": 6,
    "externalWrites": 0,
    "reputation": 0
  },
  "tags": ["MOBILE", "FOUNDER_PROOF"],
  "evidence": {
    "truth_boundary_recorded": true
  }
}
